{
  "schema_version": 3,
  "project": {
    "name": "project-control"
  },
  "tasks": [
    {
      "id": "PC-AS1-INQUIRY-CACHE",
      "kind": "task",
      "title": "Implement bounded read-only inquiry cache and incremental refresh",
      "objective": "Implement exact coalescing, stale incremental refresh, lexical log retrieval, two execution slots plus four waiting,30s foreground and300s lifetime; validate and deploy paired observer runtime.",
      "priority": 100,
      "parallel_policy": "serial",
      "scope": {
        "exclusive_paths": [
          "src/project_control/as1_jobs.py",
          "src/project_control/as1_surface.py",
          "src/project_control/as1_skill.py",
          "src/project_control/as1_contracts.py",
          "src/project_control/observer_analysis.py",
          "src/project_control/app.py",
          "tests/as1",
          "tests/test_observer_analysis_registry.py",
          "docs",
          "planning/adaptive-surface-v1",
          "src/project_control/as1_packets.py"
        ],
        "read_paths": [
          "src",
          "tests",
          "scripts",
          "packaging"
        ]
      },
      "depends_on": [],
      "gates": [],
      "result_policy": {
        "allowed_dispositions": [
          "validated"
        ]
      },
      "next_action": "Implement assigned scoped changes with Codex subagents, root integration and acceptance."
    }
  ],
  "runs": [
    {
      "id": "PC-AS1-CACHE-RUN-1",
      "root_task_id": "PC-AS1-INQUIRY-CACHE",
      "charter": {
        "objective": "Implement exact coalescing, stale incremental refresh, lexical log retrieval, two execution slots plus four waiting,30s foreground and300s lifetime; validate and deploy paired observer runtime.",
        "motivation": "Read inquiries reuse prior supported work without exposing a durable job workflow.",
        "boundaries": [
          "No project/Todo writes by observer.",
          "Preserve standalone Skills and unrelated work.",
          "Service remains stopped until validated."
        ],
        "references": [
          "planning/adaptive-surface-v1"
        ]
      },
      "lanes": [
        {
          "id": "PC-AS1-CACHE-INTEGRATE",
          "role": "integrator",
          "workspace": {
            "mode": "exclusive"
          },
          "tasks": [
            "PC-AS1-INQUIRY-CACHE"
          ]
        }
      ]
    }
  ]
}
